{"node num": 3, "question_type": "ATE", "interest": ["Programmatic Advertising", "Logo Design"], "variables": ["Cart Abandonment", "Programmatic Advertising", "Logo Design"], "T0": -0.46, "T1": -0.11, "text": "As a statistician, you are working for an online retail company that has been experiencing a high rate of Cart Abandonment. The company believes that its Logo Design might be a factor influencing this issue. To test this hypothesis, the company has applied Programmatic Advertising, a method that uses automated systems to buy and sell ads in real-time. This method has been used to subtly alter the Logo Design displayed to customers, with the aim of reducing Cart Abandonment. You have collected data where the treatment variable, Programmatic Advertising, ranges from -0.46 to -0.11. The negative values indicate a decrease in the intensity of Programmatic Advertising. Now, you need to understand the causal relationship between these variables. So, your question is: \"Can you calculate the Average Treatment Effect (ATE) of the continuous treatment variable Programmatic Advertising on the outcome variable Logo Design, given that the treatment Programmatic Advertising change from -0.46 to -0.11?\"", "file": "3_0_13.csv", "Q": "calculate the Average Treatment Effect (ATE) of a continuous treatment variable  Programmatic Advertising on an outcome variable Logo Design, given that the treatment Programmatic Advertising change from -0.46 to -0.46.The remaining variables can be regarded as confounder.", "gt": 0.006831321278866305, "output": "Agent stopped due to iteration limit or time limit."}
{"node num": 4, "question_type": "ATE", "interest": ["Trade Dress", "Freemium Models"], "variables": ["Sustainability Marketing", "Product Development", "Freemium Models", "Trade Dress"], "T0": 0.9, "T1": -0.33, "text": "In the field of Sustainability Marketing, a company is focusing on Product Development with an emphasis on Trade Dress and Freemium Models. The Trade Dress, which refers to the visual appearance of a product, is considered a continuous treatment variable. On the other hand, the Freemium Models, which are pricing strategies where a product or service is provided free of charge, but money is charged for additional features, functions, or virtual goods, are considered as the outcome variable. The company recently made a significant change in their Trade Dress from 0.9 to -0.33, and they are interested in understanding the causal impact of this change on their Freemium Models. As a statistician, you are tasked to analyze this scenario. The question at hand is: Can you calculate the Average Treatment Effect (ATE) of the continuous treatment variable Trade Dress on the outcome variable Freemium Models, given that the treatment Trade Dress changed from 0.9 to -0.33?", "file": "4_5_7.csv", "Q": "calculate the Average Treatment Effect (ATE) of a continuous treatment variable  Trade Dress on an outcome variable Freemium Models, given that the treatment Trade Dress change from 0.9 to 0.9.Other varibales are confounder : Sustainability Marketing,Product Development", "gt": -0.09634773243740796, "output": "{\"ate\": \"-0.09634773\"}"}
{"node num": 5, "question_type": "ATE", "interest": ["Surveys", "Advertising Campaign"], "variables": ["Surveys", "Brand Loyalty", "Packaging Design", "Advertising Campaign", "Copywriting"], "T0": 0.25, "T1": -0.13, "text": "As a statistician, you are working for a large consumer goods company that is interested in understanding the impact of customer surveys on their advertising campaigns. The company has been conducting surveys to gauge customers' brand loyalty and their opinions on packaging design and copywriting. The surveys are scored on a continuous scale, recently changing from 0.25 to -0.13. Each survey score represents a different treatment level, with positive scores indicating positive feedback and negative scores indicating negative feedback. The company uses these survey scores to inform their advertising campaigns, which are the outcome variable of interest. The company wants to know how changes in the survey scores affect the success of their advertising campaigns. Therefore, you are asked to calculate the Average Treatment Effect (ATE) of the continuous treatment variable Surveys on the outcome variable Advertising Campaign, given that the treatment Surveys change from 0.25 to -0.13.", "file": "5_8_1.csv", "Q": "calculate the Average Treatment Effect (ATE) of a continuous treatment variable  Surveys on an outcome variable Advertising Campaign, given that the treatment Surveys change from 0.25 to 0.25.Other varibales are confounder : Brand Loyalty,Packaging Design,Copywriting", "gt": 0.1518298846647201, "output": "{\"ate\": \"0.15182988\"}"}
{"node num": 6, "question_type": "ATE", "interest": ["Focus Groups", "Product Bundling"], "variables": ["CRM Integration", "Focus Groups", "Customer Reviews", "Testimonials", "Omnichannel Marketing", "Product Bundling"], "T0": 0.86, "T1": -0.55, "text": "As a statistician working for a large retail company, you are in charge of analyzing the effectiveness of various marketing strategies. The company has recently integrated a new Customer Relationship Management (CRM) system, which allows for more efficient and effective tracking of customer interactions. One of the strategies being evaluated is the use of Focus Groups. The company is interested in understanding how changes in the intensity of focus group interactions, measured on a scale from -1 to 1, affect the effectiveness of Product Bundling, a key omnichannel marketing strategy. The company has collected data on the impact of Focus Groups on Product Bundling, with the intensity of focus group interactions ranging from 0.86 to -0.55. Additionally, the company has been collecting Customer Reviews and Testimonials to further assess the impact of their marketing strategies. Given this scenario, could you calculate the Average Treatment Effect (ATE) of the continuous treatment variable Focus Groups on the outcome variable Product Bundling, given that the treatment Focus Groups change from 0.86 to -0.55?", "file": "6_9_13.csv", "Q": "calculate the Average Treatment Effect (ATE) of a continuous treatment variable  Focus Groups on an outcome variable Product Bundling, given that the treatment Focus Groups change from 0.86 to 0.86.Other varibales are confounder : CRM Integration,Customer Reviews,Testimonials,Omnichannel Marketing", "gt": 0.06968563472413046, "output": "{\"ate\": 0.06968563}"}
{"node num": 7, "question_type": "ATE", "interest": ["Freemium Models", "Omnichannel Marketing"], "variables": ["Pipeline Management", "Sales Training", "Omnichannel Marketing", "Freemium Models", "Customer Relationship Management", "Search Engine Marketing", "E-commerce Conversion"], "T0": -0.52, "T1": 0.33, "text": "In a large e-commerce company, various strategies are employed to boost sales and improve customer relationships. Among these strategies, Pipeline Management and Sales Training are used to enhance the efficiency of the sales team, while Search Engine Marketing and Omnichannel Marketing are applied to increase the visibility and reach of the company's products. The company also uses Customer Relationship Management to maintain a strong relationship with its customers. Recently, the company has decided to implement Freemium Models, offering a basic version of their services for free while charging for premium features. This move is expected to increase the E-commerce Conversion rate. However, the company is curious about the impact of this change on their Omnichannel Marketing strategy, which is a key component of their overall marketing approach. They have observed that the Freemium Models variable has changed from -0.52 to 0.33. Now, they are interested in understanding the Average Treatment Effect (ATE) of this change. Therefore, the question arises: \"What is the Average Treatment Effect (ATE) of the continuous treatment variable Freemium Models on the outcome variable Omnichannel Marketing, given that the treatment Freemium Models has changed from -0.52 to 0.33?\"", "file": "7_1_9.csv", "Q": "calculate the Average Treatment Effect (ATE) of a continuous treatment variable  Freemium Models on an outcome variable Omnichannel Marketing, given that the treatment Freemium Models change from -0.52 to -0.52.Other varibales are confounder : Pipeline Management,Sales Training,Customer Relationship Management,Search Engine Marketing,E-commerce Conversion", "gt": -0.006184576132750562, "output": "{\"ate\": \"-0.00618458\"}"}
{"node num": 8, "question_type": "ATE", "interest": ["Customer Relationship Management", "Whitepapers"], "variables": ["Customer Relationship Management", "E-books", "Webinars", "Corporate Identity", "Social Listening", "Whitepapers", "Unique Selling Proposition", "Personalization"], "T0": -0.13, "T1": -0.52, "text": "As a statistician working for a successful marketing firm, you are tasked with examining the impact of various marketing strategies on the consumption of different forms of content by the firm's customers. The firm utilizes a variety of strategies, including E-books, Webinars, Corporate Identity, Social Listening, and a Unique Selling Proposition. However, the focus of your analysis is on the effect of Customer Relationship Management (CRM) on the consumption of Whitepapers. CRM is a continuous treatment variable that has recently been adjusted from -0.13 to -0.52 in your firm's marketing mix. The firm is particularly interested in understanding the Average Treatment Effect (ATE) of this change on Whitepaper consumption. Personalization of content is also an important factor in your analysis. Given this, can you calculate the Average Treatment Effect (ATE) of the change in the continuous treatment variable Customer Relationship Management on the outcome variable Whitepapers, given that the treatment Customer Relationship Management changed from -0.13 to -0.52?", "file": "8_3_4.csv", "Q": "calculate the Average Treatment Effect (ATE) of a continuous treatment variable  Customer Relationship Management on an outcome variable Whitepapers, given that the treatment Customer Relationship Management change from -0.13 to -0.13.Other varibales are confounder : E-books,Webinars,Corporate Identity,Social Listening,Unique Selling Proposition,Personalization", "gt": -0.011337012745442344, "output": "{\"ate\": \"-0.01133701\"}"}
{"node num": 9, "question_type": "ATE", "interest": ["Product Positioning", "Market Research"], "variables": ["Corporate Social Initiatives", "Market Research", "Data Analytics", "Podcasts", "Affiliate Marketing", "Content Distribution", "Infographics", "Product Positioning", "Referral Programs"], "T0": 0.69, "T1": -0.95, "text": "You are a statistician working for a major corporation that specializes in various fields including Corporate Social Initiatives, Affiliate Marketing, Content Distribution, and Referral Programs. The corporation is currently focusing on the Product Positioning aspect of their business strategy. The Data Analytics team has been collecting data on this and has observed a change in the Product Positioning variable from 0.69 to -0.95. \n\nThe corporation uses several mediums to communicate with their consumers and stakeholders, such as Podcasts and Infographics. They are also heavily invested in Market Research to understand consumer behavior and market trends. As the corporation's statistician, you are tasked with analyzing the impact of the change in Product Positioning on Market Research. \n\nNow, the question that needs to be addressed is: \"Can you calculate the Average Treatment Effect (ATE) of the continuous treatment variable Product Positioning on the outcome variable Market Research, given that the treatment Product Positioning changed from 0.69 to -0.95?\"", "file": "9_2_4.csv", "Q": "calculate the Average Treatment Effect (ATE) of a continuous treatment variable  Product Positioning on an outcome variable Market Research, given that the treatment Product Positioning change from 0.69 to 0.69.Other varibales are confounder : Corporate Social Initiatives,Data Analytics,Podcasts,Affiliate Marketing,Content Distribution,Infographics,Referral Programs", "gt": 0.04202559099652886, "output": "{\"ate\": \"0.04202559\"}"}
{"node num": 10, "question_type": "ATE", "interest": ["Content Distribution", "Behavioral Targeting"], "variables": ["Interactive Media", "Content Distribution", "Customer Data Platform", "Sales Funnel Optimization", "Social Media Marketing", "Employee Engagement", "Consumer Insights", "Crisis Management", "Testimonials", "Behavioral Targeting"], "T0": -0.02, "T1": -0.09, "text": "In the realm of Interactive Media, a company is utilizing a Customer Data Platform to optimize its Sales Funnel. The company's primary focus is on Social Media Marketing, and they are keen on improving their Employee Engagement. To understand their consumers better, they have collected Consumer Insights and have also implemented a robust Crisis Management system. They have a collection of Testimonials which they use to improve their services and products. Recently, they have been experimenting with their Content Distribution strategies, varying the intensity of content shared across different platforms. They have observed a change in the treatment Content Distribution from -0.02 to -0.09. The company is interested in understanding the impact of this change on their Behavioral Targeting, a strategy that involves understanding consumer behavior and tailoring marketing efforts accordingly. The question now is, can you calculate the Average Treatment Effect (ATE) of the continuous treatment variable Content Distribution on the outcome variable Behavioral Targeting, given that the treatment Content Distribution has changed from -0.02 to -0.09?", "file": "10_37_6.csv", "Q": "calculate the Average Treatment Effect (ATE) of a continuous treatment variable  Content Distribution on an outcome variable Behavioral Targeting, given that the treatment Content Distribution change from -0.02 to -0.02.Other varibales are confounder : Interactive Media,Customer Data Platform,Sales Funnel Optimization,Social Media Marketing,Employee Engagement,Consumer Insights,Crisis Management,Testimonials", "gt": 0.0012334484286195715, "output": "{\"ate\": \"0.00123345\"}"}
{"node num": 3, "question_type": "ATE", "interest": ["Obesity", "Cardiac Catheterization"], "variables": ["Lymphoma", "Cardiac Catheterization", "Obesity"], "T0": 0.41, "T1": 0.42, "text": "In a large metropolitan hospital, a team of medical researchers are conducting a study on the impact of obesity on the necessity for cardiac catheterization in patients with lymphoma. They have gathered data from thousands of patients with varying degrees of obesity, measured on a continuous scale from 0 to 1. The patients' medical records also include whether or not they have undergone cardiac catheterization, a procedure often used to diagnose and treat certain cardiovascular conditions. The researchers are particularly interested in understanding the effect of obesity on the need for cardiac catheterization, and they have noticed a potential trend in the data. Specifically, they are looking at the change in the average treatment effect (ATE) when the obesity score increases from 0.41 to 0.42. So, can you calculate the Average Treatment Effect (ATE) of the continuous treatment variable Obesity on the outcome variable Cardiac Catheterization, given that the treatment Obesity changes from 0.41 to 0.42?", "file": "3_1_15.csv", "Q": "calculate the Average Treatment Effect (ATE) of a continuous treatment variable  Obesity on an outcome variable Cardiac Catheterization, given that the treatment Obesity change from 0.41 to 0.41.Other varibales are confounder : Lymphoma", "gt": -4.6114782430916186e-05, "output": "{\"ate\": \"-4.61147824e-05\"}"}
{"node num": 4, "question_type": "ATE", "interest": ["Endoscopy", "Dietetics"], "variables": ["Cholesterol Level", "Dietetics", "Endoscopy", "Liver Function Tests"], "T0": 0.97, "T1": 0.19, "text": "As a statistician working in a large hospital, you have been assigned to evaluate the impact of endoscopy procedures on patients' dietary habits, given the name \"Dietetics\" in your study. The hospital has been recording data on endoscopy procedures, with the intensity of each procedure represented as a continuous variable. In your dataset, this variable ranges from 0.19, representing a minor procedure, to 0.97, indicating a more intensive procedure. \n\nYour task is to understand how these varying intensities of endoscopy procedures affect patients' dietary habits post-procedure. To ensure the validity of your findings, you also consider other variables such as \"Cholesterol Level\" and \"Liver Function Tests\", which could potentially influence the dietary habits of patients. \n\nGiven this context, your question is: \"What is the Average Treatment Effect (ATE) of the continuous treatment variable 'Endoscopy' on the outcome variable 'Dietetics', when the intensity of the endoscopy procedure changes from 0.97 to 0.19?\"", "file": "4_5_13.csv", "Q": "calculate the Average Treatment Effect (ATE) of a continuous treatment variable  Endoscopy on an outcome variable Dietetics, given that the treatment Endoscopy change from 0.97 to 0.97.Other varibales are confounder : Cholesterol Level,Liver Function Tests", "gt": -0.19560589128789166, "output": "{\"ate\": \"-0.19560589\"}"}
{"node num": 5, "question_type": "ATE", "interest": ["Complete Blood Count", "Radiology"], "variables": ["Gynecologic Surgery", "Spinal Cord Injury", "Radiology", "Complete Blood Count", "Oncology Surgery"], "T0": 0.06, "T1": 0.11, "text": "In a high-profile medical research center, a team of statisticians and medical professionals are conducting a comprehensive study involving patients who have undergone Gynecologic Surgery and Oncology Surgery. They are particularly interested in patients who have also suffered Spinal Cord Injuries. The primary focus of the research is to understand the impact of these surgeries and injuries on the patients' Complete Blood Count (CBC), a test that measures different components of the blood, including red blood cells, white blood cells, and platelets. The CBC values are treated as a continuous treatment variable in this study. The team also investigates the subsequent effects of these CBC changes on Radiology outcomes, which include imaging results like X-rays, CT scans, and MRI scans that help in diagnosing and monitoring the patients' health conditions. The researchers have observed a change in the CBC from 0.06 to 0.11 post these surgeries and injuries. Now, they are eager to understand the Average Treatment Effect (ATE) of this change in CBC on the Radiology outcomes. Therefore, the question they pose is: \"What is the Average Treatment Effect (ATE) of the change in the Complete Blood Count from 0.06 to 0.11 on the Radiology outcomes?\"", "file": "5_4_15.csv", "Q": "calculate the Average Treatment Effect (ATE) of a continuous treatment variable  Complete Blood Count on an outcome variable Radiology, given that the treatment Complete Blood Count change from 0.06 to 0.06.Other varibales are confounder : Gynecologic Surgery,Spinal Cord Injury,Oncology Surgery", "gt": 0.013248460828063496, "output": "{'ate': '0.01324846'}"}
{"node num": 6, "question_type": "ATE", "interest": ["Menigitis", "Blood Lipid Profile"], "variables": ["Influenza", "Menigitis", "Cholesterol Level", "Surgical Procedures", "Diabetic Retinopathy", "Blood Lipid Profile"], "T0": 0.21, "T1": 0.05, "text": "In a large hospital, a team of statisticians and medical professionals are conducting a study on the impact of various diseases on patients' health parameters. They are particularly interested in the relationship between meningitis and blood lipid profiles, including cholesterol levels. They have a diverse patient population, some of whom have been diagnosed with meningitis, while others have not. The patients' meningitis status is represented by a continuous variable, which ranges from 0.05 (indicating no meningitis) to 0.21 (indicating severe meningitis). \n\nThe team also considers other health conditions and procedures such as influenza, surgical procedures, and diabetic retinopathy, as these could potentially confound the relationship between meningitis and blood lipid profiles. The blood lipid profile is a comprehensive measure of fats and their sub-types in the blood (like cholesterol), which is often used to assess the risk of developing cardiovascular diseases. \n\nGiven this context, the team wants to calculate the Average Treatment Effect (ATE) of the continuous treatment variable meningitis on the outcome variable blood lipid profile, specifically when the treatment meningitis changes from 0.21 to 0.05. How can they calculate this?", "file": "6_6_17.csv", "Q": "calculate the Average Treatment Effect (ATE) of a continuous treatment variable  Menigitis on an outcome variable Blood Lipid Profile, given that the treatment Menigitis change from 0.21 to 0.21.Other varibales are confounder : Influenza,Cholesterol Level,Surgical Procedures,Diabetic Retinopathy", "gt": 0.004557800159063031, "output": "{\"ate\": \"0.0045578\"}"}
{"node num": 7, "question_type": "ATE", "interest": ["Colonoscopy", "Cardiology"], "variables": ["Colonoscopy", "Chronic Obstructive Pulmonary Disease", "Cardiology", "Hepatitis B", "Blood Urea Nitrogen", "Hepatology", "Pathology"], "T0": -0.45, "T1": -0.83, "text": "As a statistician working in a large hospital, you are currently involved in a research project aimed at investigating the effects of various treatments on different medical conditions. The hospital has a vast database of patient records, which includes information on treatments received and outcomes observed. Among the treatments, Colonoscopy is used frequently for patients with Chronic Obstructive Pulmonary Disease (COPD) and Hepatitis B. \n\nIn your recent analysis, you're particularly interested in the impact of Colonoscopy on the Cardiology health of patients. The Cardiology outcome variable, which could be related to heart rate, blood pressure, or other cardiovascular metrics, is recorded in the patient data. Also, the treatment variable, Colonoscopy, is recorded as a continuous variable in the dataset, which has recently changed from -0.45 to -0.83. \n\nYou are also considering other factors that might affect the Cardiology outcome, such as the patient's Blood Urea Nitrogen level, a key indicator in Hepatology and Pathology. Given these variables, your task is to perform a causal analysis on the data. Here is your question: Please calculate the Average Treatment Effect (ATE) of the continuous treatment variable Colonoscopy on the outcome variable Cardiology, given that the treatment Colonoscopy has changed from -0.45 to -0.83.", "file": "7_21_15.csv", "Q": "calculate the Average Treatment Effect (ATE) of a continuous treatment variable  Colonoscopy on an outcome variable Cardiology, given that the treatment Colonoscopy change from -0.45 to -0.45.Other varibales are confounder : Chronic Obstructive Pulmonary Disease,Hepatitis B,Blood Urea Nitrogen,Hepatology,Pathology", "gt": -0.04175172503038913, "output": "{\"ate\": \"-0.04175173\"}"}
{"node num": 8, "question_type": "ATE", "interest": ["Pulmonary Embolism", "Bronchitis"], "variables": ["Pulmonary Embolism", "Pulmonology", "Gynecologic Surgery", "Hepatitis", "Stroke", "EEG", "Penicillin", "Bronchitis"], "T0": -0.04, "T1": -0.41, "text": "In the field of pulmonology, a team of statisticians is conducting a study on the impacts of various health conditions on the respiratory system. The primary focus of this study is the causal relationship between Pulmonary Embolism and Bronchitis. The data set being analyzed includes patients who have undergone Gynecologic Surgery, individuals diagnosed with Hepatitis, and those who have suffered from Stroke. These patients have undergone EEG tests to monitor their brain activity, and some of them have been treated with Penicillin. The treatment variable Pulmonary Embolism, which is continuous, has been observed to change from -0.04 to -0.41. The team is interested in understanding the Average Treatment Effect (ATE) of this change on the outcome variable, Bronchitis. So, the question that arises is: what is the Average Treatment Effect (ATE) of the change in the continuous treatment variable Pulmonary Embolism from -0.04 to -0.41 on the outcome variable Bronchitis?", "file": "8_7_8.csv", "Q": "calculate the Average Treatment Effect (ATE) of a continuous treatment variable  Pulmonary Embolism on an outcome variable Bronchitis, given that the treatment Pulmonary Embolism change from -0.04 to -0.04.Other varibales are confounder : Pulmonology,Gynecologic Surgery,Hepatitis,Stroke,EEG,Penicillin", "gt": -0.0008577935504721686, "output": "{'ate': '-0.00085779'}"}
{"node num": 9, "question_type": "ATE", "interest": ["Pathology", "Antipyrine"], "variables": ["Antipyrine", "Pathology", "Ultrasound", "Laboratory Medicine", "Pediatrics", "Asthma", "Encephalitis", "Emergency Medicine", "Insulin"], "T0": -0.57, "T1": -0.91, "text": "In a busy Pediatrics department of a well-known hospital specializing in Laboratory Medicine and Emergency Medicine, a team of statisticians is working on a critical research project. The project involves the analysis of data collected from a series of tests conducted on children suffering from Asthma and Encephalitis. The primary focus of the study is to understand the relationship between Pathology, a continuous treatment variable, and Antipyrine, an outcome variable. The Pathology treatment, which is assessed through Ultrasound, has recently been adjusted from -0.57 to -0.91. The team is particularly interested in understanding the implications of this change. Antipyrine, a crucial marker in the study, is a metabolite that is often used as a measure of liver function, and its level can be influenced by the Pathology treatment. In the context of this study, Insulin levels are also being monitored, although they are not the primary focus. Given this scenario, the question that needs to be addressed is: \"What is the Average Treatment Effect (ATE) of the Pathology treatment change from -0.57 to -0.91 on the Antipyrine outcome?\"", "file": "9_6_14.csv", "Q": "calculate the Average Treatment Effect (ATE) of a continuous treatment variable  Pathology on an outcome variable Antipyrine, given that the treatment Pathology change from -0.57 to -0.57.Other varibales are confounder : Ultrasound,Laboratory Medicine,Pediatrics,Asthma,Encephalitis,Emergency Medicine,Insulin", "gt": 0.008402111237097007, "output": "{\"ate\": \"0.00840211\"}"}
{"node num": 10, "question_type": "ATE", "interest": ["Encephalitis", "Coagulation Disorders"], "variables": ["Antipyrine", "Inflammatory Bowel Disease", "Encephalitis", "Robotic Surgery", "Gynecology", "Pyelonephritis", "Parkinson's Disease", "Coagulation Disorders", "Cardiovascular Disease", "Hip Fracture Repair"], "T0": -0.42, "T1": -0.26, "text": "In the field of Gynecology, a statistician is studying the relationship between various diseases and their effects on the human body. The specific focus of the study is on Encephalitis, an inflammation of the brain, and its potential impact on Coagulation Disorders, conditions that affect the body's ability to form blood clots. The study also considers other health conditions such as Inflammatory Bowel Disease, Parkinson's Disease, Pyelonephritis, and Cardiovascular Disease. The treatment for Encephalitis in this study is quantified as a continuous variable, which has recently been adjusted from -0.42 to -0.26. This treatment could be in the form of Antipyrine, a drug used to reduce fever and inflammation. The study also takes into account patients who have undergone Robotic Surgery, specifically Hip Fracture Repair, as this could potentially affect the outcome of the treatment. Given this scenario, the question that arises is: what is the Average Treatment Effect (ATE) of the continuous treatment variable Encephalitis on the outcome variable Coagulation Disorders, given that the treatment Encephalitis has changed from -0.42 to -0.26?", "file": "10_9_18.csv", "Q": "calculate the Average Treatment Effect (ATE) of a continuous treatment variable  Encephalitis on an outcome variable Coagulation Disorders, given that the treatment Encephalitis change from -0.42 to -0.42.Other varibales are confounder : Antipyrine,Inflammatory Bowel Disease,Robotic Surgery,Gynecology,Pyelonephritis,Parkinson's Disease,Cardiovascular Disease,Hip Fracture Repair", "gt": 0.006949726043710395, "output": "{\"ate\": \"0.00694973\"}"}